{
  "fieldName": "getPost",
  "dataSourceName": "MyDynamoDBDataSource",
  "requestMappingTemplate": "{\"version\":\"2018-05-29\",\"operation\":\"GetItem\"}",
  "responseMappingTemplate": "$util.toJson($ctx.result)",
  "kind": "UNIT",
  "pipelineConfig": "example-string",
  "syncConfig": "example-string",
  "cachingConfig": "example-string",
  "maxBatchSize": 0,
  "runtime": "example-string",
  "code": ""
}